[
  {"id":"product.vision","version":1,"role":"product-vision","description":"Why the product exists and what outcome it creates.","required_knowledge":["problem and users","product outcome","success boundaries"],"blocking_questions":["What problem does the product solve?"],"update_triggers":["product.changed"],"eligible_owners":["human-maintained","atlas-maintained"],"staleness":{"mode":"trigger-based"}},
  {"id":"project.scope","version":1,"role":"scope","description":"In-scope, non-goals, and compatibility boundaries.","required_knowledge":["in-scope capabilities","non-goals","compatibility constraints"],"blocking_questions":["What is explicitly out of scope?"],"update_triggers":["scope.changed"],"eligible_owners":["human-maintained","atlas-maintained"],"staleness":{"mode":"trigger-based"}},
  {"id":"architecture.system","version":1,"role":"system-architecture","description":"System boundaries, components, dependencies, and external integrations.","required_knowledge":["system boundaries","major components","dependency direction","external integrations"],"blocking_questions":["What owns canonical state?","Which components may mutate it?"],"update_triggers":["architecture.changed","public-api.changed"],"eligible_owners":["human-maintained","atlas-maintained"],"staleness":{"mode":"trigger-based"}},
  {"id":"testing.strategy","version":1,"role":"testing-strategy","description":"Validation levels, quality gates, fixtures, and evidence expectations.","required_knowledge":["test levels","quality gates","conformance strategy","evidence expectations"],"blocking_questions":["Which checks block completion?"],"update_triggers":["test-policy.changed","schema.changed"],"eligible_owners":["human-maintained","atlas-maintained"],"staleness":{"mode":"trigger-based"}},
  {"id":"security.trust","version":1,"role":"security-trust","description":"Trust boundaries, permissions, secrets, and recovery.","required_knowledge":["trust boundaries","permission model","secrets model","recovery"],"blocking_questions":["Which actions require explicit approval?"],"update_triggers":["security-policy.changed","permission.changed"],"eligible_owners":["human-maintained","atlas-maintained"],"staleness":{"mode":"trigger-based"}},
  {"id":"installation.lifecycle","version":1,"role":"installation","description":"Installation, update, rollback, and uninstall behavior.","required_knowledge":["installation paths","ownership","rollback strategy","uninstall safety"],"blocking_questions":["What happens after interrupted update?"],"update_triggers":["installation.changed","release.changed"],"eligible_owners":["human-maintained","atlas-maintained"],"staleness":{"mode":"trigger-based"}},
  {"id":"cli.reference","version":1,"role":"cli-reference","description":"Commands, arguments, outputs, and exit codes.","required_knowledge":["command surface","machine output","exit codes","examples"],"blocking_questions":["Which commands are stable?"],"update_triggers":["cli.changed"],"eligible_owners":["human-maintained","atlas-maintained","generated"],"staleness":{"mode":"trigger-based"}},
  {"id":"ui.documentation","version":1,"role":"ui-documentation","description":"UI flows, states, accessibility, tokens, and visual evidence.","applicability":{"capabilities_any":["desktop-gui","web-application","ui"]},"required_knowledge":["user flows","screens and states","accessibility","visual validation"],"blocking_questions":["Which user states must be supported?"],"update_triggers":["ui.changed"],"eligible_owners":["human-maintained","atlas-maintained"],"staleness":{"mode":"trigger-based"}}
]
